"id","title","year","language","authors"
"uc1.32106013692600","La Hojarasca /","1994","spa","García Márquez, Gabriel, 1928-"
"uc1.$b151287","La vida y la época del caos y tiranía de América.","1959","spa","Eguza, Tirso de, pseud."
"hvd.32044013537329","Juana la bruja; novela histórica.","1894","spa","Caicedo Rojas, José, 1816-1898."
"inu.32000003308659","La leyenda de los duendes /","1951","spa","Uribe Holguín, Alberto."
"txu.059173018679818","Que viva la música : novela /","1977","spa","Caicedo Estela, Andrés, 1951-1977."
"txu.059173026698670","Luchas sociales; novela.","1920","spa","Arenas, Jesús."
"txu.059173023777623","El festival de los puentes,","1968","spa","Caicedo, Miguel A., 1919-"
"txu.059173026699402","60 ""minutos"".","1933","spa","Calderón Ramírez, Tomás, 1891-"
"txu.059173026639692","Sombía; aventuras en la selva.","1965","spa","Chaves Sicard, Emilia."
"mdp.39015017689863","La cárcel; novela","1972","spa","Zárate Moreno, Jesús."
"txu.059173026698432","Ayer, nada más : novela /","1930","spa","Alvarez Lleras, Antonio, 1892-"
"mdp.39015027544033","Copos da espuma.","1918","spa","Vargas Vila, José María, 1860-1933."
"txu.059173026537310","Requiem por un corazón; primera novela sobre un trasplante de corazón.","1970","spa","Morales-Pino, Augusto."
"txu.059173024334639","Sol en Tambalimbú : (novela) /","1949","spa","Castrillón Arboleda, Diego."
"txu.059173024301720","El angel del bosque; recreaciones morales - libro para la familia. Novela orijinal,","1876","spa","Torres Torrente, Bernardino, 1813-1886."
"ien.35556019356633","Cosme /","1985","spa","Fuenmayor, Jose Felix, 1885-1966."
"txu.059173026537433","La candelaria /","1974","spa","Mújica, Elisa."
"txu.059172013427730","Entre primos /","1897","spa","Marroquín, José Manuel, 1827-1908."
"uc1.b3784073","Un tal Bernabé Bernal /","1975","spa","Salom Becerra, Alvaro."
"uc1.$b151393","Hombres trasplantados, novela de colonizaje,","1943","spa","Buitrago, Jaime."
"txu.059173023777871","Las luces de la tarde, Bogotá 6 p.m.; novela.","1968","spa","Camelo, Julio Alejandro."
"uc1.b3785043","El desertor : relatos /","1973","spa","Mendoza, Plinio Apuleyo."
"txu.059173026689828","Mis respetables jefes /","1961","spa","Zacs, Vera."
"txu.059173023796377","El gris de una tarde.","1960","spa","Montoya Cualla, Luis."
"txu.059173023777758","Andando.","1963","spa","Calle, Mery."
"txu.059173024505403","Disloques; crítica de costumbres y apuntes frívolos de ambiente regional.","1936","spa","Carreño, Gabriel."
"txu.059173026548677","La última orden; novela.","1944","spa","González Q., Alvaro."
"txu.059173024332688","En el país de los mediocres,","1941","spa","Cortés Z., Camilo E. (Cortés Zapata)"
"txu.059173026536452","La tierra desnuda.","1920","spa","Sánchez Gómez, Gregorio."
"txu.059173024359833","La ciudad y el viento; novela.","1961","spa","Airó, Clemente, 1918-"
"txu.059173024413327","La calle 10 [i.e. diez] : novela /","1960","spa","Zapata Olivella, Manuel."
"txu.059173023778717","Chambu, novels.","1946","eng","Chaves, Guillermo Edmundo."
"inu.30000006621985","Tierra llana; temas araucanos y de los Llanos de Apure.","1963","spa","Loyo Rojas, Raúl, 1904-1965."
"txu.059173024413440","Detrás del rostro.","1969","spa","Zapata Olivella, Manuel."
"txu.059173024448310","La frontera; novela.","1961","eng","Delgado Nieto, Carlos, 1914-"
"hvd.hnjpdn","El doctor Témis. Novela orijinal escrita por el malogrado joven granadino,","1851","spa","Gaitán, José María Ángel, 1819-1851."
"txu.059173026546285","Entre dos almas.","1932","spa","Lucio, Manuel Jesus."
"txu.059173026529945","Erase una montaña de silencio.","1970","spa","Paredes Pardo, Jaime."
"txu.059173024461727","Ana de Castrillon /","1952","spa","Jaramillo Sierra, Bernardo."
"wu.89107686099","El despertar de los demonios; novela.","1968","spa","Aragón Pardo, Víctor, 1905-"
"txu.059173023781904","Flor de Corralitos de Piedra; [cronicas de Cartagena, en prosa y verso]","1961","spa","Lemaitre, Daniel."
"uc1.$b15732","Orú, aceite de piedra [novela]","1949","spa","Canal Ramírez, Gonzalo."
"txu.059173026548586","Sodoma, novela.","1961","spa","Gómez Valderrama, Francisco."
"txu.059173023954060","Se han cerrado los caminos; novela.","1949","spa","Salcedo de Medina, Olga."
"txu.059172112000770","La última escala del Tramp Steamer /","1989","spa","Mutis, Alvaro."
"txu.059173023791941","La hora de morir; novela.","1959","spa","Gómez Valderrama, Francisco."
"ien.35556029067972","Ilona llega con la lluvia /","1992","spa","Mutis, Alvaro"
"txu.059173023792911","Crónica de ultratumba.","1969","spa","Hoyos, Hernán."
"txu.059173026730273","Tormenta de ensueños, novela.","1950","spa","Carrillo Castro, Moisés."
"inu.39000003878134","Zoraya, una vida de amor y santidad.","1935","spa","Samper Ortega, Daniel, 1895-1943."
"txu.059173026537218","La fiera (novela) ...","1927","spa","Montoya, Wenceslao."
"uc1.$b463224","Manuel Pacho /","1969","spa","Caballero Calderón, Eduardo, 1910-"
"txu.059173026537579","Infierno azul; o, El país de los toxicómanos. [Novela]","1939","spa","Noguera Corredor, V."
"txu.059173025121611","Tela de araña : novela /","1974","spa","Dueñas Ruiz, Oscar José."
"uc1.$b151370","El alcalde; novela.","1973","spa","Alonso Villegas, Oscar."
"txu.059173026529832","Doña Trina.","1971","spa","Ospina de Ospina, Elena."
"hvd.hnjpcg","Blas Gil.","1896","spa","Marroquín, José Manuel, 1827-1908."
"inu.39000005102830","La tierra es del Indio; novela indigenista. Escenario: La selva y los resguardos indigenas. Personages: Los propios indios de la parcialidades de Colombia.","1955","spa","Buitrago, Jaime."
"txu.059173023796399","Tierra, amor y sangre.","1944","spa","Mora Angel, Francisco."
"hvd.hnjpcf","Amores y leyes /","1898","spa","Marroquín, José Manuel, 1827-1908."
"txu.059173026638350","Sangre y petróleo.","1970","spa","Buenahora, Gonzalo."
"txu.059173026526561","Lejos del mar ; Asaltos /","1985","spa","García Herreros, M. (Manuel), 1894-1950."
"txu.059173026525230","Mi revólver es más largo que el tuyo /","1977","spa","Duque López, Alberto, 1943-"
"txu.059172013679991","Las siete vidas de Midas.","1973","spa","Ariza, Susana de."
"inu.39000004532722","Episodios novelescos de la historia patria : la insurrección de los comuneros /","1887","spa","Acosta de Samper, Soledad, 1833-1903."
"uc1.$b116043","Los de en medio /","1938","spa","Morales-Pino, Augusto."
"txu.059173026706235","El fantasma de la calle 14 [i.e. catorce].","1972","spa","Delgado Fernández, Carlos."
"txu.059173026699526","Eramos doce, [novela]","1963","spa","Canal Ramírez, Gonzalo."
"txu.059173023792900","Ron, ginger y limón; novela.","1962","spa","Hoyos, Hernán."
"txu.059173026648263","Vuelta a una tarde en 80 cuadros, novela.","1971","spa","Gómez Monedero, Alvaro."
"uva.x030348408","Razas perdidas : viajes y aventuras por el misterioso Vaupés y el Amazonas /","1985","spa","Martínez Delgado, Jesús."
"txu.059173023788415","Zig zag en las bananeras; novela.","1964","spa","Tovar Mozo, Efraín."
"txu.059173024585220","Los leopardos.","1935","spa","Ramírez Moreno, Augusto, 1900-"
"txu.059173026537444","El doctor Pescaderas, novela de costumbres.","1909","spa","Muñoz, Luis J."
"inu.30000057282505","Hace tiempos /","1995","spa","Carrasquilla, Tomaś, 1858-1940."
"txu.059173023952814","A través del velo, novela.","1950","spa","Restrepo de Thiede, María."
"nyp.33433074370275","Nuestro siglo XIX : cuadros nacionales /","1868","spa","Madiedo, Manuel María, 1818-1888."
"inu.39000005102764","Café exasperación.","1963","spa","Botero Restrepo, Jesús, 1921-"
"txu.059173026526572","Rufo, gobernador; novela.","1966","spa","García, José Joaquín."
"nc01.ark:/13960/t9959wr38","El cisne blanco : novela psicológica /","1917","spa","Vargas Vila, José María, 1860-1933."
"txu.059173026649346","008 contra Sancocho; novela.","1970","spa","Hoyos, Hernán."
"inu.30000007139037","El coronel no tiene quien le escriba /","1972","spa","Garca̕ Mr̀quez, Gabriel, 1928-"
"txu.059173024359742","Yugo de niebla /","1948","spa","Airó, Clemente, 1918-"
"txu.059173023792933","El Quijote de Puaqui, novela colombiana de tropicales aventuras.","1951","spa","Hoyos, Carlos J."
"txu.059173024410125","Italo Fontana (novela inédita)","1930","spa","Vargas Vila, José María, 1860-1933."
"uc1.$b463659","La penúltima hora; novela.","1955","spa","Caballero Calderón, Eduardo, 1910-"
"txu.059173023796297","Abismo florecido, novela colombiana.","1948","spa","Montoya, Wenceslao, 1889-1971."
"txu.059173024350817","El buen salvaje /","1967","spa","Caballero Calderón, Eduardo, 1910-"
"hvd.32044080654601","El último rei de los muiscas; novela histórica.","1864","spa","Rozo, Jesús Silvestre, 1830-1895."
"txu.059173026525490","Sonia; novela.","1962","spa","Echeverri Perico, Rafael."
"inu.39000005981399","El 9 de abril (novela).","1951","spa","Gómez Corena, Pedro."
"txu.059173026535165","La Negra y la Asociación de Usuarios Campesinos de El Carmen /","1974","spa","Aceros C., Hugo."
"uiuo.ark:/13960/t9380nt2j","Tránsito /","1886","spa","Silvestre, Luis Segundo de, 1838-1887."
"txu.059173023792922","Callejón de San Roque; novela.","1956","spa","Hoyos, Hernán."
"wu.89107688095","Don Mirócletes","1932","spa","González, Fernando, 1895-1964."
"uc1.$b463774","La procesión de los ardientes /","1973","spa","Gómez Valderrama, Pedro, 1923-"
"txu.059173023791839","Viernes 9 : novela /","1953","spa","Gómez Dávila, I. (Ignacio)"
"uc1.$b463772","Un campesino sin regreso","1959","spa","Jaramillo Arango, Euclides."
"txu.059173026550340","Pura gente! Novela.","1972","spa","Martínez Zulaica, Antonio."
"txu.059173024505232","El Zarco.","1925","spa","Carrasquilla, Tomás, 1858-1940."
"txu.059173026637697","La picúa cebá; novela.","1966","spa","Barco de Valderrama, Lucy."
"nc01.ark:/13960/t9f481c21","Lirio blanco : Delia /","1920","spa","Vargas Vila, José María, 1860-1933."
"mdp.39015051443847","Los elegidos /","1999","spa","López Michelsen, Alfonso, 1913-2007."
"mdp.39015043096695","Catalina : novela /","1998","spa","Mújica, Elisa."
"txu.059173026698498","Los ojos del buho; novela.","1966","spa","Aragón Pardo, Víctor, 1905-"
"txu.059173026537375","Alonso Qvijano el bveno (Don Qvijote en Villaseñor)","1930","spa","Motta Salas, Julián."
"txu.059173026535074","Tierra virgen : novela /","1978","spa","Zuleta, Eduardo, 1860-1937."
"inu.39000008744570","Sobre el agua obscura.","1955","spa","Ferro, Alberto."
"txu.059173024555922","Yo, Tomás Cipriano de Mosquera","1969","spa","Perico Ramírez, Mario H."
"inu.39000005572727","Los asteroides; novelas cortas.","1927","spa","Martinez Zaldua, Ramon."
"inu.39000005731984","Las fuerzas humanas, novela.","1926","spa","Sondereguer, Pedro."
"txu.059173024530626","Las memorias de Marcela.","1934","spa","Mallarino Issacs, Manuelita."
"txu.059173024410023","La conquista de Bizancio ...","1919","spa","Vargas Vila, José María, 1860-1933."
"txu.059173024425880","El tonel de Diogenes (manual del cinico perfecto)","1925","spa","Restrepo, Enrique."
"uc1.b4380014","La boba y el Buda /","1975","spa","Alvarez Gardeazábal, Gustavo."
"txu.059173026546070","El diablo anda por la aldea [novela.","1965","spa","López Gómez, Adel, 1901-"
"pst.000005048199","Cuandro las madres lloran; Carmencita,","1966","spa","Caicedo, Miguel A., 1919-"
"mdp.39015025376750","Donde moran los sueños [novela]","1947","spa","Ibañez, Jaime, 1919-"
"txu.059173026546194","Impresiones de Jaime Kéndel.","1934","spa","Márquez Bravo, Tomás."
"txu.059173026639400","Tras las colinas, la esperanza.","1971","spa","Castillo Valero, Juan."
"txu.059173026529752","Alborada en penumbra : novela /","1974","spa","Páez Escobar, Gustavo."
"txu.059173026698487","El dilema de un vagabundo.","1935","spa","Arango, Antonio J."
"uc1.b4380017","Uisheda; violencia en el llano.","1970","spa","Valencia Tovar, Alvaro."
"txu.059173026637460","Sueño para empezar a vivir.","1973","spa","Aristizábal, Alonso."
"uc1.$b151291","El duelo de Erasmo, ficción dramática en cinco actos con un introito y un epílogo, precedida por el interludio El reconocimiento de las sombras.","1960","spa","Aragón Pardo, Víctor, 1905-"
"uc1.$b770599","La brecha; novela.","1950","spa","Martínez Orozco, Alfredo."
"txu.059173023790520","Los sonidos del fuego. +","1968","spa","Fayad, Luis."
"txu.059173026537364","Las hijas de gracia, novela de costumbres.","1951","eng","Moreno, Magda."
"txu.059173026699209","Lejos del nido : novela /","1964","spa","Botero, Juan José, 1840-1926."
"wu.89044259414","Rebatiña : novela /","1974","spa","Torres Neira, Hernando, 1914-"
"nc01.ark:/13960/t05x2m83w","Alba roja /","1902","spa","Vargas Vila, José María, 1860-1933; Rodo,́ Jose ́Enrique, d 1871-1917"
"txu.059173024410158","María Magdalena : novela lírica /","1990","spa","Vargas Vila, José María, 1860-1933."
"txu.059173024411004","Vidas de Caín.","1947","spa","Vélez Sáenz, José."
"txu.059173026647012","Dos veces Alicia.","1972","spa","Angel, Albalucía, 1939-"
"inu.39000005560763","La tierra eramos nosotros : novela /","1945","spa","Mejía Vallejo, Manuel."
"uc1.$b463793","Viento seco /","1973","spa","Caicedo, Daniel."
"mdp.39015028320417","Diana cazadora ...","1942","spa","Soto Borda, Clímaco, 1870-1919."
"wu.89017614520","El huerto del silencio : tragedia lírica /","1974","spa","Vargas Vila, José María, 1860-1933."
"uc1.$b497065","Las esmeraldas sagradas (el tesoro de Fura-Tena); novela.","1974","spa","Arango Cano, Jesús."
"txu.059173023793390","Parajes y visiones; recreación científica.","1944","spa","Jiménez Arrechea, S. (Santiago)"
"txu.059173025496669","Los ratones van al infierno.","1964","spa","Arango, Gonzalo."
"uc1.$b151321","Presencia del pueblo en Tomás Carrasquilla.","1959","spa","Cadavid Uribe, Gonzalo, 1920-"
"txu.059173026551219","Andanzas del Ronco Montoya.","1969","spa","Montoya Calderón, Alfonso."
"uc1.c022509818","Un bel morir /","1989","spa","Mutis, Alvaro."
"txu.059173026549250","Maria /","1978","spa","Isaacs, Jorge, 1837-1895."
"hvd.32044080651763","La mujer infiel, apuntes de la vida intima en forma de novela historica.","1887","spa","Amezquita, Cándido."
"txu.059173026699242","Viaje sin pasajero ; novela.","1966","spa","Bonilla-Naar, Alfonso, 1916-1978."
"txu.059173023364124","Testamento del paisa /","1982","spa","Jaramillo Londoño, Agustín."
"uc1.$b770560","El paraíso de los malos.","1965","spa","Vulliamy, Luis."
"txu.059173024545827","Quién dijo miedo.","1960","spa","Sanín Echeverri, Jaime."
"txu.059173024521738","Hombres sin presente (novela de empleados públicos).","1938","spa","Osorio Lizarazo, J. A. (José Antonio), 1900-"
"txu.059173024448139","El limbo : novela /","1958","spa","Delgado Nieto, Carlos, 1914-"
"inu.39000005050351","Abismos, novela (ensayo biológico-social)","1932","spa","Carrasquilla C., Luis."
"ien.35556017717729","Cóndores no entierran todos los días /","1982","spa","Alvarez Gardeazábal, Gustavo."
"uc1.$b463161","Asesinos; novela","1968","spa","Arbeláez A , Bernardo J."
"txu.059173018473776","Tierrabuena, seguido de evocaciones /","1977","spa","Jiménez Mejía, Rodrigo, 1904-"
"pst.000005100286","El tesoro de Quinnunch ́: novela [por] Felipe Fernández I.","1965","spa","Fernández I, Felipe."
"mdp.39015028332875","El hombre bajo la tierra ...","1944","spa","Osorio Lizarazo, J. A. (José Antonio), 1900-1964."
"uc1.$b723206","Hados, novela.","1929","spa","Pinzon Castilla de Carreno-Mallarino, Isabel."
"txu.059173026648219","Una maestra, una vida, un destino; [novela]","1969","spa","Gónima, Ester."
"uc1.$b147293","De noche brillan las lacras","1973","spa","Martín de Rosal, Nina."
"uc1.$b151328","Guayacán; novela","1966","eng","Prada Sarmiento, J M"
"txu.059173024542320","Viva la vida! Memorias de un cuarentón.","1934","spa","Sierra, Aquileo."
"txu.059173026543709","Almas dolientes /","1973","spa","Vargas Vila, José María, 1860-1933."
"txu.059173026689307","Los espejismos de la oscuridad /","1981","spa","Velasco Chaparro, Aquilino."
"hvd.32044080652746","Insondable; novela.","1907","spa","Espinosa, Antonio R."
"uc1.$b151430","Las mismas historias /","1974","spa","Mercado, Jairo; Mercado, JoseÌ RamoÌn"
"uc1.b2856979","El alférez real.","","spa","Palacios, Eustaquio, 1830-1898."
"txu.059173023795443","El extranjero (novela americano)","1928","spa","Mateus, Jorge."
"nc01.ark:/13960/t9j394086","Las rosas de la tarde ... /","1918","spa","Vargas Vila, José María, 1860-1933."
"txu.059173023793266","Barrancabermeja; novela de proxenetas, rufianes, obreros y petroleros.","1934","spa","Jaramillo Arango, Rafael."
"txu.059173026525296","Esa edad.","1974","spa","Domínguez Vasquez, Nelly."
"txu.059173024521750","La cara de la miseria,","1926","spa","Osorio Lizarazo, J. A. (José Antonio), 1900-"
"txu.059173026537262","Diás en blanco (novela)","1957","spa","Morales-Pino, Augusto."
"txu.059173023952610","Los romances del pecado /","1945","spa","Reyes Rojas, Luis."
"hvd.hwqxpx","Grandeza [novela]","1910","spa","Carrasquilla, Tomás, 1858-1940."
"uc1.$b151437","Unos años, una noche; novela","1968","spa","Dow D., Alberto, 1923-"
"txu.059173023356851","Un ángel de la calle; novela.","1952","spa","Arce Aragón, Efraín."
"uc1.b3783938","La gallina ciega; novela","1972","spa","Ponce de León París, Fernando, 1917-"
"uc1.$b151439","Manuela ...","1942","spa","Diaz Castro, Eugenio, 1804-1865."
"txu.059173026549035","Cada voz lleva su angustia /","1974","spa","Ibáñez, Jaime."
"uc1.$b147280","Un viaje alrededor del mundo y a Alpha por un antioqueño, Felipe","1965","spa","Henao, Engelberto G."
"txu.059173024532971","El niño que vivió su vida.","1939","spa","López Gómez, Adel, 1901-"
"txu.059173023952836","David, hijo de Palestina.","1931","spa","Restrepo Jaramillo, José."
"uc1.$b169070","Mundo roto : novela /","1973","spa","Soto Aparicio, Fernando, 1933-"
"txu.059173023796560","El embrujo del microf́ono; novela.","1948","spa","Moreno, Magda."
"txu.059173026550227","Los rudimentos; novela.","1963","spa","Perea, Jaime, 1933-"
"txu.059173024397118","La biografía de Gloria Étzel.","1929","spa","López de Mesa, Luis, 1884-1967."
"txu.059173023795590","La ratonera;","1968","spa","Mejía Gómez, Gabriel."
"txu.059173026530897","La criolla; [vida de Policarpa Salavarrieta.","1969","spa","Umaña, Enriqueta de."
"txu.059173024507216","El diablo sube el telón.","1955","spa","Beltrán, Germán, 1928-"
"txu.059173026638623","Pozo cegado; relato.","1966","spa","Cadavid Uribe, Gonzalo, 1920-"
"txu.059173023796322","Ceniza común.","1954","spa","Montezuma Hurtado, Alberto."
"inu.39000005981860","Juan Grillín, nuevas aventuras.","1940","spa","González, Ernesto."
"uc1.b4309885","Los años de la asfixia; [novela].","1969","spa","Stevenson, José, 1932-"
"txu.059173023796446","Más acá.","1948","spa","Morales Pradilla, Próspero, 1920-"
"uc1.$b770788","Redoblan los tambores; novela, basada en la vida de Policarpa Salavarrieta.","1963","spa","Morales-Pino, Augusto."
"txu.059173026543607","Entre Dios y el diablo (novela)","1931","spa","Vallejo, Alejandro."
"txu.059173026543844","Los discipulos de Emaus /","1974","spa","Vargas Vila, José María, 1860-1933."
"txu.059173023952600","La ciudad tiene dos caminos; novela.","1953","spa","Reyes Jurado, Guillermo."
"txu.059173023507323","Caminos de piedra; estampas y leyendas del Libertador y sus tenientes.","1955","spa","Arroyave Vélez, Eduardo."
"txu.059173026689464","Sargento Matacho; novela: la vida de Rosalba Velásquez de Ruiz, ex-guerrillera libanense.","1962","spa","Vélez Machado, Alirio."
"uc1.$b151425","Viaje a la claridad /","1972","spa","Soto Aparicio, Fernando, 1933-"
"uc1.$b463069","Nadaísmo diplomático; novela.","1965","spa","Jaramillo-Giraldo, Samuel."
"uc1.$b152636","Los hombres de el dorado.","1972","spa","Posada, E. (Eduardo)"
"inu.39000005731943","El miedo de amar; novelas.","1924","spa","Sonderéguer, Pedro."
"txu.059173026549024","No volverá la aurora; novela.","1943","spa","Ibáñez, Jaime."
"txu.059173026639604","La casa grande /","1975","spa","Cepeda Samudio, Alvaro."
"txu.059173023952825","Cadenas ... y silencio; novela.","1951","spa","Restrepo de Thiede, María."
"inu.39000004423120","Siervo sin tierra /","1985","spa","Caballero Calderón, Eduardo, 1910-"
"uc1.$b497054","Soñedén","1973","spa","Salas R, Luis Alberto."
"txu.059173026698160","Labor periodistica; algunos de sus articulos publicados; critica social, de arte, literaria.","1915","spa","Albarracín C., Jacinto."
"txu.059173023788925","Anochecer en la alborada; [novela]","1967","spa","Vanegas, Anna."
"txu.059173018503800","Las pampas escandalosas.","1936","spa","Lanao Loaiza, José Ramón."
"txu.059173024363397","Los clavijos.","1943","spa","Alvarez Garzon, Juan."
"txu.059173026638634","Visibilidad cero; relato.","1966","spa","Cadavid Uribe, Gonzalo, 1920-"
"txu.059173024357827","Un poco de amor y nada mas.","1951","spa","Acevedo Latorre, Eduardo."
"txu.059173026699377","Toñito; relato sentimental.","1947","spa","Camargo Martinez, Ernesto."
"txu.059173023795341","El día octavo (de qué se ríen malditas ratas!?)","1966","spa","Martinezguerra Zambrano, Guillermo, 1937-"
"txu.059173024521727","Garabato; novela.","1939","spa","Osorio Lizarazo, J. A. (José Antonio), 1900-"
"inu.39000005624874","Fuera de la ley; historias de bandidos","1991","spa","Osorio Lizarazo, J. A. (José Antonio), 1900-"
"uc1.$b463070","Morrogacho; novela.","1963","spa","Jaramillo-Giraldo, Samuel."
"pst.000031478212","Las memorias del odio /","1992","spa","Velásquez, Rogerio, 1908-"
"txu.059173018671215","Abismos sociales.","1922","spa","Castro, Alfonso, 1878-1943."
"pst.000005044108","Y otras canoas bajan el rio ... : [novela].","1957","spa","Caneva, Rafael, 1914-"
"uc1.31822038033445","Las estrellas son negras /","2010","spa","Palacios, Arnoldo, 1924-"
"uc1.$b151418","El bazar de los idiotas /","1974","spa","Alvarez Gardeazábal, Gustavo."
"wu.89107722530","El grande ideal: novela.","1960","spa","Santos, Enrique, 1887-"
"txu.059173023798882","Nefertiti, Reina de Egipto; novela.","1961","spa","Ardila, Rubén, 1942-"
"uc1.$b151484","Minas, mulas, y mujeres, novela.","1943","spa","Toro, Bernardo."
"uc1.a0009190174","Phineés : tragedia de los tiempos de Cristo /","1912","spa","Cuervo Márquez, Emilio, 1873-1937."
"txu.059173024467097","El remordimiento (problemas de teologia moral)","1935","spa","González, Fernando, 1895-"
"txu.059173024335890","Carretera al mar.","1960","spa","Bayer, Tulio."
"mdp.39015056722765","Jiménez de Quesada.","1939","spa","Arciniegas, Germán, 1900-1999."
"uc1.$b151487","Rosalba (historia de un amor grande y verdadero)","1949","spa","Suárez, Arturo, 1905-"
"txu.059173023794043","Los olvidados.","1950","spa","Lara Santos, Alberto."
"txu.059173026545930","La tragedia de Nilse.","1928","spa","López de Mesa, Luis, 1884-1967."
"txu.059173024521658","El criminal (novela)","1935","spa","Osorio Lizarazo, J. A."
"wu.89107722779","En el cerezal, acuarelas literarias de la Sabana de Bogotá.","1924","spa","Samper Ortega, Daniel, 1895-1943."
"txu.059173026699049","Nieve Maldita.","1950","spa","Bedoya Céspedes, Libardo."
"txu.059173024461421","La aduana.","1960","spa","Jaramillo, Manuel José."
"txu.059173026648897","Al final de la calle; novela.","1966","spa","Hernández Monsalve, Oscar, 1925-"
"txu.059173024545510","La amazona de Cañas : novela /","1958","spa","Sánchez Gómez, Gregorio."
"txu.059173026522924","Fusilamiento; novela.","1955","spa","Reyes Jurado, Guillermo."
"pst.000005047727","El dia del odio /","1952","spa","Osorio Lizarazo, J. A. (José Antonio), 1900-"
"uc1.31822035052158","La monja miliciana /","1938","spa","Jeréz, Hipólito"
"uc1.$b151367","Puerto silencio /","1974","spa","Soto Aparicio, Fernando, 1933-"
"txu.059173026689125","Secuestro y rescate; [novela.","1963","spa","Yarce Tabares, Efraím."
"inu.39000005624866","El pantano, novela.","1952","spa","Osorio Lizarazo, José Antonio."
"txu.059173026552357","Sol en las Bardas","1953","spa","Colón, Carlos E."
"uc1.$b151470","El capitán; [novela histórica.","1968","spa","Jaramillo Botero, Bernado."
"txu.059173026553203","El hombre de Talara, y Bajo Cauca;","1964","eng","Echeverri Mejía, Arturo, 1919-"
"uc1.$b151351","El monstruo; novela.","1955","spa","Pareja, Carlos Henrique, 1900-"
"uc1.$b150383","El viaje.","1974","spa","Ruiz, Roberto, 1925-"
"inu.39000001934137","Corral de negros; [novela.","1963","spa","Zapata Olivella, Manuel."
"txu.059173024507227","Burbujas; novela.","1961","spa","Beltrán, Germán, 1928-"
"txu.059173026699399","Petalos dispersos.","1959","spa","Calle, Mery."
"txu.059173026521852","El terremoto; novela.","1966","spa","Pinzón, Germán."
"mdp.39015035340341","La nieve del almirante /","1986","spa","Mutis, Álvaro."
"txu.059173023798510","El hombre de la granja,","1945","spa","Alvear Restrepo, José."
"mdp.39015065474523","El espejo sombrío; novela.","1967","spa","Soto Aparicio, Fernando, 1933-"
"txu.059173023742797","Juguetes rotos.","1957","spa","Calle, Mery."
"uc1.$b504420","Después empezará la madrugada /","1974","spa","Soto Aparicio, Fernando, 1933-"
"txu.059173026538152","Quiriley.","1973","spa","Piñeros Corpas, Joaquín."
"txu.059173026552120","Después de la noche (sinopsis de una novela)","1964","spa","Leal, Eutiquio."
"txu.059173009879270","Risaralda.","1960","spa","Arias Trujillo, Bernardo, 1903-1938."
"txu.059173026647431","Del mismo origen; [novela.","1966","spa","López Cardona, Silvio."
"txu.059173026545919","Lo que el cielo no perdona novela historica.","1954","spa","Blandón Berrío, Fidel."
"txu.059173026689238","Noviazgo de una colegiala.","1972","spa","Velásquez Sánchez, Darío."
